{
  "schema_version": 1,
  "rig_name": "calibration_Jun30_2022_rig",
  "description": "Canonical four-camera surround-view rig",
  "coordinate_system": {
    "frame": "vehicle",
    "length_unit": "mm",
    "rotation_representation": "matrix3x3",
    "notes": "Vehicle frame: +X forward, +Y left, +Z up."
  },
  "cameras": [
    {
      "id": "cam_front",
      "role": "front",
      "projection_model": "fisheye",
      "image_size": [
        1280,
        944
      ],
      "intrinsics": {
        "focal_length_px": [
          332.3808,
          332.2021
        ],
        "principal_point_px": [
          640.0464,
          471.5343
        ],
        "skew": 0.0
      },
      "distortion": {
        "model": "fisheye_polynomial4",
        "coefficients": [
          0.122,
          -0.0496,
          0.0146,
          -0.0023
        ]
      },
      "pose_vehicle": {
        "translation": [
          2481.05322265625,
          -16.713512420654297,
          630.5935668945312
        ],
        "rotation": [
          [
            0.011420577519863896,
            -0.17589233987732,
            0.9843431592598153
          ],
          [
            -0.9999081808669813,
            -0.009189457355347062,
            0.00995910180680707
          ],
          [
            0.007293849765169933,
            -0.9843665164185521,
            -0.1759811385052601
          ]
        ]
      },
      "source": {
        "dataset": "calibration_Jun30_2022",
        "sensor_name": "front",
        "notes": "Generated from per-camera intrinsics JSON and extrinsics-svs.json."
      }
    },
    {
      "id": "cam_left",
      "role": "left",
      "projection_model": "fisheye",
      "image_size": [
        1280,
        944
      ],
      "intrinsics": {
        "focal_length_px": [
          332.1396,
          332.0149
        ],
        "principal_point_px": [
          640.4395,
          472.6487
        ],
        "skew": 0.0
      },
      "distortion": {
        "model": "fisheye_polynomial4",
        "coefficients": [
          0.1162,
          -0.0411,
          0.0096,
          -0.0013
        ]
      },
      "pose_vehicle": {
        "translation": [
          656.0616455078125,
          1022.9325561523438,
          976.1361083984375
        ],
        "rotation": [
          [
            0.9825105444432347,
            -0.13373851490364946,
            -0.12956480883798982
          ],
          [
            -0.036855985396159335,
            -0.8217171402777107,
            0.5687025388674639
          ],
          [
            -0.18252305716905087,
            -0.5539810023865327,
            -0.8122748196247843
          ]
        ]
      },
      "source": {
        "dataset": "calibration_Jun30_2022",
        "sensor_name": "left",
        "notes": "Generated from per-camera intrinsics JSON and extrinsics-svs.json."
      }
    },
    {
      "id": "cam_rear",
      "role": "rear",
      "projection_model": "fisheye",
      "image_size": [
        1280,
        944
      ],
      "intrinsics": {
        "focal_length_px": [
          332.9741,
          332.8108
        ],
        "principal_point_px": [
          639.5389,
          471.5607
        ],
        "skew": 0.0
      },
      "distortion": {
        "model": "fisheye_polynomial4",
        "coefficients": [
          0.1163,
          -0.045,
          0.0128,
          -0.002
        ]
      },
      "pose_vehicle": {
        "translation": [
          -2423.49365234375,
          19.247669219970703,
          993.4749755859375
        ],
        "rotation": [
          [
            0.019475650127954165,
            0.3643296522969077,
            -0.9310663797545843
          ],
          [
            0.999184952460062,
            -0.04002483207794178,
            0.005238663428396685
          ],
          [
            -0.035357175077726115,
            -0.930409542768316,
            -0.36481221593605684
          ]
        ]
      },
      "source": {
        "dataset": "calibration_Jun30_2022",
        "sensor_name": "rear",
        "notes": "Generated from per-camera intrinsics JSON and extrinsics-svs.json."
      }
    },
    {
      "id": "cam_right",
      "role": "right",
      "projection_model": "fisheye",
      "image_size": [
        1280,
        944
      ],
      "intrinsics": {
        "focal_length_px": [
          331.5987,
          331.2099
        ],
        "principal_point_px": [
          639.2839,
          472.0183
        ],
        "skew": 0.0
      },
      "distortion": {
        "model": "fisheye_polynomial4",
        "coefficients": [
          0.1144,
          -0.0422,
          0.0106,
          -0.0015
        ]
      },
      "pose_vehicle": {
        "translation": [
          595.8697509765625,
          -990.92626953125,
          967.9507446289062
        ],
        "rotation": [
          [
            -0.9762946096355662,
            -0.11843494669844107,
            -0.18116842604900818
          ],
          [
            0.0002781219510850086,
            0.8363276299390534,
            -0.5482298952526267
          ],
          [
            0.21644573880009246,
            -0.5352842784923383,
            -0.816469217640334
          ]
        ]
      },
      "source": {
        "dataset": "calibration_Jun30_2022",
        "sensor_name": "right",
        "notes": "Generated from per-camera intrinsics JSON and extrinsics-svs.json."
      }
    }
  ]
}
